{
  "$schema": "./dna.schema.json",
  "version": "1.0.0",
  "generatedAt": null,
  "productName": null,
  "productTagline": null,

  "archetype": {
    "primary": null,
    "secondary": null,
    "description": null,
    "archetypeOptions": [
      "The Sage",
      "The Creator",
      "The Ruler",
      "The Magician",
      "The Hero",
      "The Outlaw",
      "The Explorer",
      "The Innocent",
      "The Everyman",
      "The Lover",
      "The Jester",
      "The Caregiver"
    ]
  },

  "brandPromise": {
    "statement": null,
    "proofPoints": [],
    "constraints": []
  },

  "emotionalSignature": {
    "primary": null,
    "secondary": null,
    "avoided": [],
    "emotionSpectrum": {
      "power": 0,
      "trust": 0,
      "precision": 0,
      "warmth": 0,
      "innovation": 0,
      "stability": 0
    }
  },

  "visualSignature": {
    "typography": {
      "serifFamily": null,
      "serifUsage": [
        "headings",
        "hero-text",
        "narrative-blocks",
        "brand-moments"
      ],
      "monoFamily": null,
      "monoUsage": [
        "code",
        "data",
        "timestamps",
        "ids",
        "technical-labels"
      ],
      "sansFamily": null,
      "sansUsage": [
        "ui-labels",
        "buttons",
        "navigation",
        "body-text"
      ],
      "scale": {
        "xs": "0.75rem",
        "sm": "0.875rem",
        "base": "1rem",
        "lg": "1.125rem",
        "xl": "1.25rem",
        "2xl": "1.5rem",
        "3xl": "1.875rem",
        "4xl": "2.25rem",
        "5xl": "3rem",
        "6xl": "3.75rem",
        "7xl": "4.5rem"
      },
      "lineHeight": {
        "tight": 1.1,
        "snug": 1.25,
        "normal": 1.5,
        "relaxed": 1.625,
        "loose": 2
      }
    },

    "color": {
      "mode": "oklch",
      "palette": {
        "primary": {
          "base": null,
          "light": null,
          "dark": null,
          "contrast": null
        },
        "secondary": {
          "base": null,
          "light": null,
          "dark": null,
          "contrast": null
        },
        "accent": {
          "base": null,
          "light": null,
          "dark": null,
          "contrast": null
        },
        "neutral": {
          "50": null,
          "100": null,
          "200": null,
          "300": null,
          "400": null,
          "500": null,
          "600": null,
          "700": null,
          "800": null,
          "900": null,
          "950": null
        },
        "semantic": {
          "success": null,
          "warning": null,
          "error": null,
          "info": null
        }
      },
      "lightTheme": {
        "background": null,
        "foreground": null,
        "muted": null,
        "mutedForeground": null,
        "border": null,
        "ring": null
      },
      "darkTheme": {
        "background": null,
        "foreground": null,
        "muted": null,
        "mutedForeground": null,
        "border": null,
        "ring": null
      }
    },

    "layout": {
      "spacingUnit": 8,
      "spacingScale": {
        "0": "0px",
        "1": "8px",
        "2": "16px",
        "3": "24px",
        "4": "32px",
        "5": "40px",
        "6": "48px",
        "8": "64px",
        "10": "80px",
        "12": "96px",
        "16": "128px"
      },
      "containerWidths": {
        "sm": "640px",
        "md": "768px",
        "lg": "1024px",
        "xl": "1280px",
        "2xl": "1536px"
      },
      "borderRadius": {
        "none": "0",
        "sm": "4px",
        "md": "8px",
        "lg": "12px",
        "xl": "16px",
        "full": "9999px"
      },
      "signatureMotif": null,
      "gridSystem": "12-column"
    },

    "texture": {
      "enabled": true,
      "noiseType": "perlin",
      "noiseOpacity": 0.03,
      "noiseScale": 1.5,
      "ditheringEnabled": true,
      "ditheringPattern": "ordered-4x4",
      "applicationAreas": [
        "hero-backgrounds",
        "card-backgrounds",
        "dividers",
        "section-transitions"
      ],
      "excludedAreas": [
        "body-text",
        "form-inputs",
        "buttons",
        "navigation"
      ],
      "gpuBudgetMs": 2
    },

    "motion": {
      "enabled": true,
      "reducedMotionRespected": true,
      "timingFunctions": {
        "default": "cubic-bezier(0.4, 0, 0.2, 1)",
        "in": "cubic-bezier(0.4, 0, 1, 1)",
        "out": "cubic-bezier(0, 0, 0.2, 1)",
        "bounce": "cubic-bezier(0.68, -0.55, 0.265, 1.55)"
      },
      "durations": {
        "instant": "50ms",
        "fast": "100ms",
        "normal": "200ms",
        "slow": "300ms",
        "slower": "500ms"
      },
      "signatureBehavior": null,
      "microInteractions": {
        "buttonHover": null,
        "buttonPress": null,
        "cardHover": null,
        "inputFocus": null,
        "toggleSwitch": null,
        "menuOpen": null,
        "modalOpen": null,
        "toastEnter": null,
        "skeletonPulse": null
      },
      "pageTransitions": {
        "enter": null,
        "exit": null,
        "shared": null
      }
    },

    "depth": {
      "shadows": {
        "sm": null,
        "md": null,
        "lg": null,
        "xl": null
      },
      "layering": {
        "base": 0,
        "raised": 1,
        "floating": 2,
        "overlay": 3,
        "modal": 4,
        "toast": 5
      }
    }
  },

  "verbalTone": {
    "personality": [],
    "avoided": [],

    "microcopy": {
      "style": null,
      "examples": {
        "buttonPrimary": null,
        "buttonSecondary": null,
        "linkText": null,
        "placeholder": null,
        "label": null,
        "hint": null
      }
    },

    "errorMessages": {
      "style": null,
      "examples": {
        "validation": null,
        "network": null,
        "permission": null,
        "notFound": null,
        "serverError": null
      }
    },

    "emptyStates": {
      "style": null,
      "examples": {
        "noData": null,
        "noResults": null,
        "noAccess": null,
        "onboarding": null
      }
    },

    "systemMessages": {
      "style": null,
      "examples": {
        "success": null,
        "warning": null,
        "info": null,
        "loading": null,
        "confirmation": null
      }
    }
  },

  "iconography": {
    "style": null,
    "strokeWidth": null,
    "cornerStyle": null,
    "library": null,
    "customSymbols": [],
    "usageRules": []
  },

  "guardrails": {
    "visualDonts": [],
    "verbalDonts": [],
    "competitorReferences": [],
    "trademarkNotes": [],
    "accessibilityRequirements": [
      "WCAG 2.2 AA minimum",
      "Color contrast 4.5:1 for text",
      "Color contrast 3:1 for UI",
      "Focus indicators visible",
      "Reduced motion respected"
    ]
  },

  "metadata": {
    "createdBy": null,
    "approvedBy": null,
    "lastUpdated": null,
    "changelog": []
  }
}
